listing_id,id,date,reviewer_id,reviewer_name,comments
5731498,29457107,2015-04-07,23095855,Paolo,"The house is beautiful, we were the first guests and everything was perfect. the house is actually a typical town center house with kind of courtyard, but more than anything else: it is in the very center of plaka, in the middle of it all.
Furniture classy design (design chairs of XX century masters) and all comforts.
George was very helpful: we needed a hair dryer and he got it to us the first day. Also very nice in arranging times of departure and baggage drop off. Really, super. Thanks"
5731498,31016835,2015-04-30,31804508,Catherine,"Magnifique maison bourgeoise au centre de Plaka, au coeur de la vieille ville et tout au pied de l'Acropole!  Un vrai bonheur, à 5 mn des principaux monuments et musées, à proximité des restaurants et des bars où l'on peut déguster un bon déjeuner grec en contemplant le Panthéon."
5731498,31974621,2015-05-12,25774985,Sam,Lovely apartment. Host was helpful. Very clean. Great location.
5731498,32256117,2015-05-16,27845791,Di,Our experience in George's house is really great. The house is in an wonderful location and the rooms are large.
5731498,32659424,2015-05-19,33411612,Antonis,"Το σπιτάκι είναι εξαιρετικό, ανακαινισμένο, φωτεινό με μικρή εσσωτερική αυλή και πάνω απ όλα σε φανταστική περιοχή. Βρίσκεται μόνο δευτερόλεπτα μακριά από το μετρό Ακρόπολης και το Μουσείο.

Ο Γιώργος απάντησε άμεσα, το σπίτι ήταν πεντακάθαρο και όλα ήταν ομαλά. Σίγουρα θα ξαναπάω! "
5731498,33153814,2015-05-25,4158744,Turid Og Erling,"The apartment had a wonderful location in Plaka and was nice, clean and spatious! We didnt meet George but he was communicating politely in messages and offered transport at reasonable prices to/from airpot/port and the apartment. Unfortunately we did not get the message about how to turn on aircondition and hot water until the second day but his helper came and fixed it."
5731498,33458512,2015-05-28,9867287,Annie,"George was a great host and very quick in communicating. He helped secure transport to the airport and his driver was very friendly and prompt. Someone met us at the apartment to show us around and give restaurant suggestions. The location of this apartment could not be better as you are right in the Plaka on a pedestrian street and within a 2 minute walk of a back (and less crowded) entrance of the Acropolis. We had so much fun exploring all of the streets of the Plaka and trying many different cafes, restaurants and bars. You have to try the Gyros in Monastiraki Square which was an excellent place to people watch.

The apartment itself was wonderful. Very spacious, full of light and had everything we needed, even a hookah! The Acropoli Metro station was maybe 2 minutes away. We took the metro from the Ferry port which was an experience for sure!
Thanks for everything George!"
5731498,33932927,2015-06-02,30841515,Tracey,"The house was wonderful - clean, well-appointed and in a great location in Plaka. Very close to the Acropolis Museum and the Acropolis itself. A bit noisy as the house is on a busy Plaka street. But this only adds to the atmosphere. We were a party of 5 and would stay here again.
My only concern is the small size of the bathroom, but this is not major. "
5731498,34258600,2015-06-06,1929948,Ben,"This apartment was great!

We didn't meet George but his employee met us at the apartment and helped us get situated. It was in the center of all the heavy tourist action (just as we hoped), clean, and looked just like it does in the photos here. All the appliances and fixtures worked well, including the hot water and shower.

One thing to keep in mind: the apartment is on the ground floor and the bedrooms look out onto a busy, touristy street. This is, in my opinion, a great feature! However, street noise might be an issue for some. It didn't bother us at all but it is worth mentioning."
5731498,34554503,2015-06-09,21784822,David,"My family of 5 had a great experience spending three nights at George's Vyronos St flat in the Plaka. Location was even better than expected in a very clean upscale pedestrian only area.
Very easy access to the Acropolis. The Acropolis was a short block or two away.
George was very responsive and easy to deal with. He arranged a reasonably priced airport transfer which was a welcome comfort after our long flight. Would definitely recommend our experience to others."
5731498,34784812,2015-06-12,32072646,Rick,Great location. Very clean. George arranged transfers from airport which was very helpful. Everything you need to see and great restaurants are all in walking distance.
5731498,35112068,2015-06-15,33278513,Mariana,"I had a wonderful stay at George's house in Plaka. The place is exactly as shown in the pictures, beautiful and impeccably clean. The house is very spacious and it's location couldn't be better. Plaka is one of the nicest neighbourhoods in Athens, with all major attractions at walking distance. George was very thoughtful and had everything organised for our late arrival (after midnight). He also gently accepted my request for a late check out. I would definitely recommend this place, not only for the amazing house but also for its thoughtful host.   "
5731498,37146146,2015-07-05,4397982,Natalia,"The apartment is located in the best imaginable spot in Athens - on a walking street in Plaka walking distance to several subway stops (Acropolis Museum is the closest - 3 min away).  It has a large beautiful yard as well.  The street stays lively during the day, but it has good windows and with the fan on, one can rest during the day. It is quiet at night. The apartment was clean and had all the modern conveniences.  It has air-conditioning in the living room and one bedroom and a fen in each.  One can leave the door of the 2nd bedroom open for air.  The only major downside is that the bathroom is outdated and small, but the location and size compensate for it.  The host was also very responsive to all communication and our needs! "
5731498,37626151,2015-07-08,40967,Erica,"George was one of the most efficient hosts I have ever encountered, and the flat in Plaka was hands-down the most beautiful apartment I saw in Athens (or practically anywhere), with huge windows and high ceilings that stream in the sun. The place was sparkling clean when we arrived, check-in was easy, and the location just could not be beat. George was super prompt with answering any questions or responding to any of our problems (even when we stupidly locked ourselves out of the house, George came to our rescue immediately!). One of the most professional and courteous Airbnb experiences I have ever had, and one of the loveliest Airbnb flats I have ever had the privilege to stay in! Thanks again~"
5731498,37754282,2015-07-10,34061966,Katie,"Location was excellent, just a couple blocks from the grande promenade and the Temple of Zeus. Apartment was clean and easy to get to."
5731498,38432199,2015-07-15,37003377,Long,"We didn't meet George but the driver check us into the apartment.  We dropped the luggage there and came back after the maid cleaned the apartment. Very nice apartment and perfect location next to Acropolis, metro, Plaka street, cool AC in living room and one bedroom. George also helped to arrange a private half day tour to Sounion and transfer back to airport. Make sure good  correspondence with George and his office upfront.  Recommended Appartment and service."
1108690,4616454,2013-05-15,6108106,Lily,"Just came back from a wonderful trip to Athens :)

The studio could not have been better located: it is in the middle of everything! Yet, I enjoyed quiet and silence when I was there: to me, it is priceless.

The place is just as described and seen in the pictures. It is therefore quite simple, but it has all the basics needed if you're just looking for a place to sleep and rest. When I arrived, everything was clean and neat and Leonidas left a plate of fruits as a welcoming gift.

Leonidas is a very kind host who made everything easy. He was waiting for me at the metro station and gave me tips. When the wifi didn't work, without even asking, he gave me a partial refund.
I only regret not to have been able to attend his concert!

Positive: the location, the host, the silence, the price.
Negative: don't expect to cook or entertain people. Only bare necessities are available. However, it is a very good for value  place!

Overall: would definitely come back :) Thank you for everything!


"
1108690,4693013,2013-05-20,3579072,Aimee,"Stayed for the weekend... perfect location! Close to everything... Acropolis and Parthenon within walking distance, some good restaurants on the same street and nearby.  Leon was a very good host and the studio was very clean and comfortable! Highly recommended!"
1108690,4912921,2013-06-01,3270462,Michael,"Great location, good space, very nice host and great value!"
1108690,5008305,2013-06-07,6002893,Eileen,"Leonidas was very helpful and friendly. He met us at the apartment and gave us advice as to how to find  different areas. What a great location - right next to the Acropolis!   Many wonderful places to eat near by.
"
1108690,5046380,2013-06-09,4962335,Ryan,"Perfect location, clean apartment and friendly host! Would recommend "
1108690,5073154,2013-06-10,2504555,Eleonore,"The apartment is an oasis of quiet conveniently located in the center. Leonidas is a thoughtful and friendly host.
Great experience and value."
1108690,5087730,2013-06-11,5068583,Esther,A lovely studio apartment right behind the new acropolis museum. It's a great place to stay at if you're looking for a place where you can do your sightseeing at the acropolis all day. Not to mention that the acropolis station is one stop away from the Symtanga square which makes it very convenient. Coming from the airport was hassle free! Leonidas was a great host too! :)
1108690,5215401,2013-06-18,3679396,Cécile,"Good spot to visit the acropolis and Athens ( near subway, easy to go to the airport). Leonidas is friendly and helpful.
The place to stay !"
1108690,5301921,2013-06-23,5660042,Tammy,"Convenient little flat in a great location!  Very kind, friendly host.  Only negative was confusion about check-in and dates but answered my call and was at the flat with keys in 10 minutes so no big deal.  Highly recommend!"
1108690,5399773,2013-06-28,6351267,Saphia,"Nous avons passés une nuit chez leonidas. Bien que nous soyons arrivés en avance, il était la pour nous accueillir . Le studio etait simple mais propre et comfortable. Point important, le studio est très proche du metro acropolis (pratique pour rejoindre l aeroport ) , de l'acropole et des restos , dans un quartier tranquille. Enfin, Leonidas est une personne charmante et disponible. Bref, a recommander! Merci encore Leonidas"
1108690,5512604,2013-07-03,4248460,Christopher,Nice little place next to the Acropolis museum. Very close to subway station and many interesting (tourist) spots.
1108690,5551806,2013-07-05,4524561,Christine,"Leonidas is a wonderful host, and the apartment is just perfect for a few days in Athens - centrally located (next to the Akropolis and a delicious family-run restaurant), yet really quiet and cozy. We really enjoyed our stay. Thank you, Leonidas!"
1108690,5566993,2013-07-06,5594057,Molly,Leonidas's apartment is well aituated for visiting the Acropolis (right next door to the Acropolis Museum).  Excellent restaurants nearby. It is simply furnished and had everything we needed.
1108690,5610661,2013-07-08,3306430,André,Perfect location and a great host. I can definitely recommend Leonidas appartment
1108690,5783055,2013-07-16,6135302,Rachael,"I want to give a 4 1/2 star rating, this place is great for a few nights in Athens. It has all of the essentials, bed, bath room and a superb location. Leon is great, he met us at the door, helped with any information we wanted about the city and even had a few pieces of fruit for us. he gave us a heads up as well about an all publc transit shut down which luckily we were leaving Athens the day before. This flat is good for two people. The BEST location I have been for the price, only a few blocks from the main Acropoli metro stop which means right in the heart of old Athens (Acropolis, museum, Plaka and shopping district). The 1/2 star off is because of the futon bed which is not the most comfortable. I would highly recommend this flat and Athens!!"
1108690,5837814,2013-07-18,3611232,New,The apartment is located in a prime location. The neighborhood is safe at all times (day and night). All major tourist sites and restaurants are within a short walking distance from the apartment. The apartment is clean and very basic. The Internet works well. Be aware that there is no AC (I don't use one anyway) also note that the futon mattress is not so comfortable to sleep on. If the mattress was different I would give it a 10 out of 10. The host is attentive and wonderful.
1108690,5955238,2013-07-23,6990639,Greg,"This a great little apartment! It is right directly across the street from the Acropolis Museum - you couldn't get any closer.
You can cook your own food or try one of the many nearby restaurants. It is a perfect base from which to explore central Athens. "
1108690,5969621,2013-07-24,4249624,Catrin & Sebastian,"Great location for exploring all parts of Athens. Leonidas place could not be more central.The flat is just off to the Acropolis museum.The apartment itself is pretty basic, but it´s the perfect place for short stays. Besides the futon bed ( nothing for old bones and backs ;-)) I would highly recommend the appartment.  Leonidas is a very friendly and nice guy and easy to talk to. Thank you very much!"
1108690,5994695,2013-07-25,1165452,Julie,Leonidas was the perfect host. His abode is simple and that was perfect for us. He is one of the freindliest and down to earth men in Athens and is also a very well travelled one so he understands the ways and needs of fellow travellers which is to make them feel at home and he did just that. I'm sure we will see him again.
1108690,6050143,2013-07-28,4554085,Johanna,"Leon is a fantastic host, who is very concerned about the guest's comfort. The apartment is in an amazing location, and is extremely convient to the Acropolis metro, to tourist attractions, and to cafes and shops. I found the bed perfectly comfortable. It was a great pied-a-terre for me in Athens!"
1108690,6117839,2013-07-30,5210284,John,Great place. Simple but very clean and practical studio right next to the Acropolis Museum. Ideal location. Leonidas is a really nice guy and the check in was very smooth. Recommended.
1108690,6204833,2013-08-03,7610785,Stephanie,Leon was very friendly and hospitable. The place was in a great location and was just as described.
1108690,6249779,2013-08-05,6810990,Simone,"This stay again with Leonidas was very nice. I had the possibility to check in a little bit earlyer. That was very nice.
Leonidas is an friendy and helpful host. "
1108690,6304807,2013-08-07,7086094,Lena,"Leonidas is a very nice host, always quick to react to questions and interested in discussions. The apartment is simple but perfectly clean and in an amazing area in athens - check out the bakery nearby (best blueberry-muffins ever) and the openair cinema thision. Thanks for everything leonidas!"
1108690,6412857,2013-08-11,615622,Philip,Thanks! Great location and value!
1108690,6437970,2013-08-12,3196507,Aurore,Lovely flat just near the Acropolis Museum and Leonidas is very pleasant!
1108690,6488270,2013-08-14,7105080,Lea,Very good location! simple but practical.
1108690,6512919,2013-08-15,697401,Nick,"Athens was amazing and I had a great time at Leonidas flat. Definitely recommend it for a young couple or single traveling to Athens to see the major sites. Close to everything. I walked to the Acropolis (amazing), the museum, the Temple of Zeus and other cool places. You'll have a great stay. "
1108690,6532022,2013-08-16,6706665,Michael,"Leonidas' place was excellent for the price and location.  We walked all over Athens from that location.  The room is plain but clean and (as I've already noted) well located.  Leonidas was also really helpful, responsive and friendly.  We acidentally left a bag at the place after we left and he very kindly made sure we got it back before we returned home.  Great experience!  I would absolutely recommend this for a budget traveler."
1108690,6707785,2013-08-22,3774416,Charlotte,"In terms of locations, you could not ask for a better place in Athens. It is literally a stones throw away from the New Acropolis Museum. Located in an incredibly safe and quiet neighborhood, it is within walking distance of the subway, the Acropolis, and the Plaka area. Another great convenience is a Hop On, Hop Off stop across the street, as well as a fantastic restaurant next door. The flat has newly installed ac that made for much needed relief from the heat. And the apartment itself is the perfect size for 1-2 travelers. Leonidas was a gracious host, and incredibly accommodating to all of our needs. We would not hesitate to stay with him again."
1108690,6772868,2013-08-24,2449333,Alex,"Organized, gently, and generous. A very good host, in a very good district. Definitely recommended!"
1108690,6822298,2013-08-26,4972178,Alice,"Correspond exactement à la description: fonctionnel, très simple et tout proche de l'acropole. Parfait pour un jour ou deux, peut-être moins adapté pour un séjour plus long !
Tres bon accueil de Léonidas, bonne réactivité !"
1108690,6887350,2013-08-28,1739742,Stephan,"I only wish we had booked two nights instead of one, you cant find a better place for the location at a better price than this apartment, step out your door and around the corner are shops and restaurants. The acropolis is so close and the apartment itself is clean and spacious. Id stay here again in a second. Leon is a great host and was profession and punctual when meeting up to show us the place, thanks leon! And for anyone looking for a place, look no further!"
1108690,6897470,2013-08-29,7844873,Milena,"Leon, we had a great stay a your little Apartment. Everything was fine, clean and tidy. Thanks a lot! Milena and Vincent"
1108690,7001089,2013-09-02,5345902,Catherine,"Leon is a very nice person, very welcoming.

The apartement is very clean, very simply and extremly well located

Great experience"
1108690,7073858,2013-09-05,2055695,Jared,"The apartment was absolutely perfect for us. It's literally directly across the street from the Acropolis Museum (one of the best museums I've ever visted) and a 5-10 minute walk from one of the entrances to the Acropolis itself. Also a 2 minute walk from the subway. For those with lots of luggage, there are only a few stairs to climb. We were there on a 24-hour-ish hour layover. Flight got in late but Leon nicely met us at the apartment as promised. The proximity to the Acropolis also allowed us to do other things in Athen that we might now have had time to explore otherwise: like the cool area around the garment district and the plaka. Really enjoyable stay and highly recommended for anyone who wants to be literally steps from the acropolis without a high pricetag. Thanks much! "
1108690,7088359,2013-09-06,2064158,Carmen,Small and clean Apartment right in the Heart of Athens. We stayed here for one night before we went to the islands and it was fantastic! Akropolis and bars are very close... Everything in walking distance. Leonidas was very kind! Thanx a lot! This was a perfect start for our holidays!
1108690,7465228,2013-09-21,599727,Benjamin,"A comfortable apartment in front of the Acropolis Museum, at 5 minutes of the Acropolis entrance and surrounded by a few typical restaurants (an excellent one at 10 metres of the apartment!)
The host is really great and allowed us to an early check in.
We could not have found a more convenient place I guess and at a real fair price!
"
1108690,7490528,2013-09-22,7535144,Shirley,"leon is a really nice host，we arrived quite late because the flight was delayed，and made him waiting for so long，but he say nothing about this，and give us a warm welcome.
the apartment is located very close to the acropolis museum，we enjoyed staying there a lot！"
1108690,7554165,2013-09-24,8091679,Jean,"Very Good place for visiting the Acropole, the muséum and Plaka. The host is Kind, friendly & ponctual. Thank you."
1108690,7628145,2013-09-27,1631954,Adele & David,"Great location, walking distance to all the main sights and a few mins walk to the metro!
Delicious homemade authentic Greek food at To Kati Anno, a minute down the road!
The apartment was simple, clean and comfortable, but the kitchen could do with a fridge."
1108690,8080555,2013-10-15,4190705,George,"I said in apartment opposite Acropolis Museum (great price and location). BUT sofa bed VERY uncomfortable (and no good for two), bathroom needs improvement and kitchen lacks basic equipment.

Leon was friendly and came with much-needed extra towels.

Location, wifi and hot water excellent. BUT it was more comfortable on the floor than on the sofa bed."
1108690,8119857,2013-10-16,7582762,Markus,"Great appartment! I had a wonderful stay in Ektoras' and Leon's place. Everthings worked out just fine and Leon was taking care that i felt at home. He put in a new bed and an extra sofa, which made the place even more comfortable. When the bed was delivered he kept me updated about when he needed to enter the apartment so that i wouldn't be disturbed. I absolutely recommend the place and think you can't find anything better in such a perfect location!"
1108690,8162859,2013-10-18,896925,Aliki,"Very minimalist studio apartment, has what you need for short stay and is close to Acropolis, in good neighborhood, no problem walking at night.  Leon was nice, though only saw him for few seconds.  "
1108690,8281051,2013-10-23,3683085,Jessica,"we enjoyed our stay in this cute studio - it has everything, bathroom, kitchen, couch, and a NEW bed. Ah did I mention this place is across the street from the museum?!"
1108690,8412554,2013-10-29,9222200,Marie,"Very uncomplicated stay, we had everything we needed and were in the city center, around the corner from the Acropolis.
There is not really a nice view from the window and the apartment is small, but for two nights it was really nothing to complain about."
1108690,8532341,2013-11-04,4689260,Myriam,"Tiene todo lo que necesitas para unos días en Atenas. Una gran localización, junto a Plaka y a 50m de la Acrópolis.
León fue muy simpático y nos dejó todo lo necesario para nuestra estancia.
Buena relación calidad/precio, (solo le falta un poco de ventilación/luz a la habitación)"
1108690,8669992,2013-11-11,7639093,Dimitar,"Ektoras & Lion were great hosts, apartment was exactly  how it was described.
Thank you "
1108690,8733054,2013-11-14,6453294,John,"Excellent stay!  Leon was very helpful getting us settled in even though we were running a bit late to meet him, and everything was exactly as we expected.  Location was perfect, with an extremely easy walk to the Acropolis and the metro line.  Definitely a great value."
1108690,8860188,2013-11-22,1116989,Darryl,"The perfect place to stay in Athens - affordable, well located, very clean and with a great host! Highly recommended.  "
1108690,8929943,2013-11-26,6420530,Evelina,"It was a very nice experience. Flat is in a great location, easy to find and lovely to stay at. The host was real friendly and helpful. Thank you so very much!"
1108690,9182176,2013-12-11,1654599,Penny,"Excellent place to stay ,so central and within easy reach of cafes,internet cafe,(the flat has its own wi fi)there is even a launderette around the corner plus fresh veg shop and wholefood shop next door,in a very nice position and extremely convenient,only downside for a girl is no hairdryer!!!"
1108690,9293187,2013-12-19,1553033,Rupert,Really good location for site seeing and food. Laundromat close by sports bar. Room is simple but spacious.  Good wifi and kitchenette.  Bathroom a little awkward with hand held shower head over small tub. Hosts were very easy to work with and quick to respond when we asked to stay one more night. All up good value for your money.
1108690,9466602,2013-12-30,3870015,Alexey,Nice and simple apartment in a perfect location. Ideal for a short stay in Athens
1108690,9608529,2014-01-03,10423009,Mariella,"Sistemazione molto comoda per la collocazione. La casa e' molto spartana, e quindi non è perfetta per un soggiorno lungo ma va benissimo per uno breve. Il museo e l'acropoli sono proprio di fronte e c'è una trattoria vicinissima che consiglio. "
1108690,9747295,2014-01-07,10797397,Harjot,"Great studio apartment located near all major attractions in Athens, also very close to Metro station.  Apartment is simple and basic, but the cost and location are unbeatable.  Very friendly host! "
1108690,9881158,2014-01-16,4507073,Diego,"I spent almost 10 days in Ektoras place.
If you are a tourist you cant ask for a better place...the location make you feel like a Greek god and you are near to everything (touristic places, metro, supermarket) .

The apartment was really clean when I got there and it had almost everything I needed, the kitchen might be a bit basic (as the description say) but is enough for a short stay.

Ektoras is a really nice host, he was always available to answer me my doubts and help me, he even provide me of some kitchen stuff I asked.

I'd definitely go back again and recommend it! "
1108690,9962515,2014-01-21,9026893,Filipe,Great location. The flat is simple and efficient. I couldn't be in a better place. Leon was super helpful and easy to talk to.
