listing_id,id,date,reviewer_id,reviewer_name,comments
918812,21710758,2014-10-22,9775783,Renata,"Best location ever! We had the pleasure of staying at Dimitris` apartment for three days, and I must say, we couldn`t have chosen a better location - very near the acropolis and many attractions. Dimitris was very nice and helpful, giving us tips of how to get there. His father was at the apartment - he showed us around and we had a welcome drink - very nice. The apartment is great for a nice rest after a long day of walking through Athens - I would definetely recommend it!"
918812,21946386,2014-10-27,18502876,Fernando,"That was always excellent, since the contact! His father was a gentleman, and made our reception. He explained all we needed and they offered some things that we didn't expect like fruits, local beverage and a lot of kindness. They made our experience in Athens much better that was supposed to be. We reccomend!"
918812,22149613,2014-10-31,21785980,Nataliya,"We were warmly welcomed by Dimitris's father who waited for us outside and showed everything in the apartment. We appreciated the shots of local alcohol, beer, fruits and croissants offered at the arrival. The apartment was great and very well located. We really enjoyed the location since it was closed to everything we needed.
The internet connection was great as well. (which is very important for travelers who need to use skype like us)
Thank you for this experience!   "
918812,23179346,2014-11-24,15322790,Alahna,"Dimitris did a great job at making me feel welcome. Like was met by his father at the apartment and after a tour of the place we took shots of greek liquor together. There are some free snacks and beers provide from him too, making the place feel home-y as soon as I arrived. The neighborhood is right in the center of all the sights I wanted to see while in Athens. I was less than 10 minutes of walking from all the reatairants, ancient temples, and museums I wanted to go to. The apartment would host two easily, and three could stay there comfortably too. The wifi worked perfectly, and the heater worked great. "
918812,23962576,2014-12-15,24132037,Diana,I thoroughly enjoyed my stay here! I did not meet Dimitris directly but his father was there to welcome us in.  Due to a later flight he even stayed to wait for our arrival and was very helpful with providing directions! Very welcoming host with goodies and traditional Greek treats prepared.   The place was very comfortable and there was also two bikes available for use if needed.  If I were to return to Athens I would definitely come back!
918812,24300193,2014-12-25,3590573,Deepak,"Thank you Dmitris, Yiannis and the lovely mother for making our honeymoon so memorable! Right from the start, the warm welcome with walnut honey syrup, the traditional Greek grape juice, the bedroom decorated with flowers, all made us so overwhelmed. It's proximity to Acropolis and all other tourist place makes this place a must stay in Athens.
I strongly recommend this place to anyone planning to visit Athens. Fantastic hospitality and superb location makes it a place to "" Come Here Again""."
918812,24623758,2014-12-31,12086254,Andrey,"I stayed in this apartment in the end of December, 2014.  The host was friendly, he gave me all detailed information about this apartment. The apartment is placed in old building in the historical center of Athens, i.e. the location of the apartment is quite good for any trips in Athens.
There is only one drawback there, the apartment is placed underground (minus one floor), but it was not so critical for me because I traveled a lot and I came back to the apartment after sunset."
918812,24933305,2015-01-04,23242132,Andrea,"As soon as me and boyfriend arrived, we were greeted by his father who had little treats and raki on hand. Very sweet and welcoming. The place was clean, the heater worked well. Thank goodness! Also, the location of this place was great. A 2min walk to the Temple of Olympian and 4min walk to Acropolis. Awesome!"
918812,25249829,2015-01-10,22953275,Jean-François,"Nous avons été très bien reçu. La chambre était tel qu'indiqué et le lieu où elle est située est idéal pour ceux et celles qui veulent visiter l'Acropole et ses environs. Une seule ombre au tableau, pour cette période de l'année le système de chauffage a eu de la difficulté à suppléer aux conditions météorologiques particulièrement froides surtout la nuit. Enfin, si vous comptez manger surtout à l'extérieur et n'utiliser la chambre que pour dormir, le rapport qualité prix, compte tenu de la location idéale du logement est bon."
918812,25350685,2015-01-13,15417163,Nelli,"Nice and clean apartment very close to all sightseeing, can walk basically everywhere. The apartment is also fully equipped and even has hair straightener (though I brought mine).Dimitris was very efficient in his communication and his friend who let us in was very friendly. A very kind gesture from the host to leave us some traditional pastries and drinks. "
918812,25844067,2015-01-27,1858676,Jeannine & Claude,"Nous avons été très bien accueillis par le père de Dimitri. L'appartement est très bien situé à moins de cinq minutes à pied du métro, du musée et du site de l'Acropole. Il était très propre, confortable, bien chauffé en saison froide mais situé en sous-sol et n'offrant pas de vue. Il est plutôt rudimentaire pour cuisiner mais il y beaucoup de restaurants à proximité. Le quartier est sécuritaire et  intéressant à parcourir à pied. Bon rapport qualité/prix pour les voyageurs qui souhaitent passer du temps à l'extérieur et visiter."
918812,26102053,2015-02-03,15645474,Marilena,"Dimitris è molto accogliente, l'appartamento è funzionale e pulito.
La posizione comodissima è in centro quindi è possibile visitare Atene passeggiando perchè vicino alle attrazioni principali. vicino anche alla fermata del (website hidden) siamo trovati molto bene
Marilena"
918812,26304479,2015-02-09,2094491,Gabriella,"The location of Athens South Apartments (Plaka) was perfect! A quick walk to major sites including the Acropolis, Hadrian's Arch, Syntagma square, Hephaestus' Temple, and much more.  We packed a ton into just 3 days and the apartment made it possible! Dimitris' father, Yanus, met us with shots of Raiki, pastries, and fruit and showed us everything we needed to know about the apartment.  The apartment is partly underground, so there isn't a view, but the comfort and location completely make up for that. Highly recommended."
918812,26458623,2015-02-13,25842197,Alex,"Dimitris's father met us at the apartment and gave us a warm welcome (with a shot of raki and some cold beers in the fridge!)
It is a very nice apartment, with plenty of room, a good shower/bathroom and a small kitchen; the place was exactly as per the photos. We stayed in a cold, snowy February, but were never cold in the apartment - there is central heating, an air conditioner and a portable electric heater... so no worries there! The bed is very comfy.
The location of the apartment could not possibly be better. Literally 2 minutes walk to the gates of the Acropolis and right in the heart of everything. I would definitely recommend anyone to stay in the apartment. Well worth the money and totally hassle-free.
There were 2  bikes for us to use too as the listing said... but we didn't brave it in the snow!"
918812,26994818,2015-02-23,23704593,Sara,"the apartment is really nice and location is great. we haven't met  Dimitris, it was his father who was waiting for us and he was really kind and friendly.he explained us everything. we loved this place and Athens. i strongly recommend it to everyone."
918812,27258341,2015-03-01,13681372,Aurora,"L'accoglienza e' stata ottima,non abbiamo avuto modo di conoscere Dimitri ma abbiamo conosciuto il padre che e' stato gentilissimo.L'appartamento e' pulito la zona in cui si trova e' perfetto vicinissimo all'Acropoli,fermata della metropolitana di fronte.Tutto perfetto,speriamo di tornarci presto.Grazie"
918812,27511737,2015-03-06,22457122,羽裳,So wonderful a apartment that we had a very nice vacation. The apartment is near to many main attractions. The location is perfect. Dimitris is very kind and the two bikes he lended us are nice too. We will never forget this experience in Athens.
918812,28417819,2015-03-23,22039969,Sara,"Un apartamento PERFECTO! RECOMENDADO 100%! La comunicación con Dimitris es fácil desde el principio, está siempre disponible, y la bienvenida de su padre hizo que el viaje empezara de la mejor manera.

El apartamento está en Plaka, la mejor zona de Atenas para hacer turismo y disfrutar al máximo de la ciudad. Recomiendo totalmente alojarse  en este barrio.

El apartamento tiene todo lo necesario para pasar unos días en Atenas, está limpio, preparado y la atención al huésped es excepcional. Buena relación calidad/precio. ¡Si volvemos a Atenas, repetiremos! Gracias Dimitris y Yanis :)"
918812,28556072,2015-03-26,14576818,Fabian,"We, a young couple from Berlin, stayed in March for a few days at Dimitris apartment. The apartment was exactly as descriped and very clean. There was everything provided in the apartment - hairdryer, bed linen, towels, coffee, toilet paper, soap, bicycles etc. We didn't get to meet Dimitris but his father gave us a very warm welcome with some fruits, raki, snacks and a suggestion where to eat dinner: this was the best dinner we had in Athens! Thanks a lot for that. We really enjoyed our stay and recommend the apartment for everybody who wants to visit Athens. If we come again to Athens, we would definitely stay in the apartment again, if possible."
918812,28872282,2015-03-31,20892700,Jacy,The listing was completely accurate. Dimitris answered all our questions before arrival and useful information left in flat. Cosy flat with everything we needed. Lovely welcome on arrival. Perfect location for short stay.
918812,29397374,2015-04-07,26661911,Valentina,"A casa di Dimitri siamo stati davvero bene.
Appartamento in posizione strategica a 2 minuti a piedi dall'acropoli, dal tempio di Zeus e dallo stadio (website hidden) ha accolti il gentilissimo papà di Dimitri.
Appartamento essenziale ma pulitissimo.
Se dovessimo tornare ad Atene sceglieremo sicuramente ancora L'appartamento di Dimitri.
Consigliatissimo
"
918812,29630122,2015-04-10,29953706,Sónia,"Gostei bastante desta opção de hospedagem. O sr.Dimitris foi muito solicito, simpático e hospitaleiro.
O apartamento tem boas condições e está muito bem localizado."
918812,29821001,2015-04-13,25704703,Luiza,"The apartament is great! Very comfortable and well located! Close to Plaka, the Acropolis and the Metro station!
Dimitri's father was very kind and helpful!
I recommend the apartment!!
"
918812,30086065,2015-04-17,29641676,Μάρθα,Καλή και άμεση εξυπηρέτηση. Αρκετές παροχές. Και εξαιρετική τοποθεσια στο ιστορικό κεντρο.
918812,30663313,2015-04-26,26102397,Angel,Muy bueno
918812,31626630,2015-05-08,21931054,Belinda,"We did not have the pleasure of meeting Dimitris but we were welcomed by his lovely friend Heidi who made us feel very much at home, no mean feat seeing as we arrived at 2am!! the apartment is located in a FANTASTIC part of Athens, right in the heart of Plaka smack bang between Hadrians Arch and the Acropolis. Every major sight was no more than a 10min walk, just amazing!! The apartment itself has everything you need, there was even some complimentary croissants and fruit and raki in the fridge for us which was a nice touch "
918812,31940344,2015-05-12,5084780,Justyna,Amazing location. Within walking distance to major tourist attractions. Spacious apartment that had everything that was needed. Dimitris father was very friendly.
918812,32489351,2015-05-19,19810809,Florencia,"Beautiful place, close to everything and spacious. We were received by Dimitris father who very kindly explained everything to us. We enjoyed our stay and recommend the place."
918812,32805964,2015-05-22,5958773,Odette,We loved our stay in Drimitri's apartment. Easy to find the street coming from The AirPort by metro. The recepcion of his father was amazing. The studio is exaxtily like The photos and The location could not be best.
918812,33649613,2015-05-31,5216709,Svetlana,"It was a wonderful few days at the foot of Acropolis! Perfect location! The friendly owner, comfortable apartment. A bit unusual that is located on the underground floor, but in general everything is fine. Thank you for chance to see the dreams of ancient Gods ..."
918812,34765963,2015-06-12,12385077,Khiew,Dimitris' father came to meet us at the apartment. He was very lovely and we toasted to some Greek ouzo (I think?). He showed us around and was very detailed and helpful with what we needed in the house. Air-conditioning was good and the place was clean. A very good location 2 minutes away from the Zeus Olympian Temple and a bit more to the Acropolis. We didn't get to meet Dimitris but he was always very quick to respond to our messages and questions. We enjoyed our stay here very very much and would definitely recommend this place. Thank you Dimitris and father!
918812,35127130,2015-06-15,6748874,Federica,"Dimitris and his father are great hosts. Very flexible, precise in providing information and welcoming. The flat is as described in the ad. What I liked the most is definitely the location. Great area, very central & lively."
918812,35446916,2015-06-19,17839376,Kelly,"Our stay at Dimitris apartment was perfect. Dimitris was the most helpful airbnb host, he helped organise us tickets to our next destination which we could not have done without him. He really went above and beyond. The apartment itself was perfectly located, clean and had everything we needed. I would highly recommend this to anyone wanting to visit Athens. "
918812,35804451,2015-06-22,4398253,Jan,"Everything was great, Dimitris Dad greeted us with a shot of homemade Raki and explained everything in the apartment. He was very welcoming and gave us great tips about the city. He even showed us how to make greek coffee :-).
The apartment itself was spacious enough for 2, very clean and comfortable. The location is absolutely top, almost everything can be reached on foot and if you want to venture further out, there are even 2 bikes for you to use! Totally awesome!"
918812,36169744,2015-06-26,23408905,Pete,Good communication prior to arrival and were met at arranged time. Nice friendly welcome and explanation about the apartment and a traditional drink shared. The apartment was clean with everything you needed on hand. The best thing though is the fantastic location with everything you want to see so easily accessible. would happily return and recommend.
918812,36754709,2015-07-01,10498478,Gerard,"Très bonne location, conforme à la description : un peu sombre et pas luxueuse, mais propre, calme, fonctionnelle, bien équipée ( tout fonctionne ! ) et surtout idéalement située pour les visites et les restaus de Plaka. Dimitris est  tellement attentionné qu'on peut presque arriver dans cet appart les mains dans les poches : serviettes, papiers, 2 bières au frais, 2 croissants pour le 1er petit dej, guide et carte touristiques, 2 vélos les sportifs, parapluies pour les orages, et même un jeu de cartes ... La cuisine est minimaliste, mais suffisante pour quelques repas. Accueil très sympathique de Yannis, le père de Dimitris, qui nous attendait avant même notre appel, qui nous a aidé à garer la voiture et à décharger, qui nous a réservé le taxi pour le retour, et nous a offert l'apéro ! Bref , pour ceux qui ne cherchent pas le grand luxe, un bon rapport qualité/prix, et une location idéale,  à conseiller vivement."
918812,37160666,2015-07-05,19855196,Luis,"My girlfriend and I had a terrific experience on Dimitri's place. The flat is located in the best area a first-timer in Athens could ask for: all the main attractions are within walkable distances. Besides, the place is tidy and cozy, has good wi-fi and everything works just fine. We never had the chance to meet Dimitris, but his father was there to welcome us and answer all our questions with a gentile smile. Surely, I would recommend this place."
240960,2566819,2012-10-09,3724650,Yelena,"This  loft apartment  is stunning. Designed by architect Ioannis Karvoutzis, it is comfortable, spacious and showcases his amazing talents as an architect and interior designer.
It is located in the centre of Psiri, close to Monastiraki Square and within walking distance of Syntagma Square, Plaka and the Acropolis.

Ioannis and his partner Demi were gracious hosts, warm and welcoming and ready to provide advice about the best tavernas, music and bars to explore.

We look forward to staying there again.
"
240960,2607388,2012-10-14,166717,Andrew,"My partner and I spent a fantastic two nights in this Athens apartment. It's a very large, unique and creatively designed space with quirky touches from the vintage furniture to the art on the walls.

It's a straightforward single metro ride from the airport and the station is a short walk away. It's located in a very lively area with bars and cafes on the doorstep and a short walk to shops. We also walked to the trendy Gazi area with more bars and restaurants and the Acropolis Museum and archeological site so it's a very convenient location.

Demi and Ioannis were attentive and welcoming hosts, leaving us refreshments in the flat on arrival and giving us advice on where to go and what to do during our stay.

We'll definitely be staying again the next time we visit this exciting city.
"
240960,3170957,2012-12-28,961751,Noah,This is a gorgeous apartment with a fantastic host in one of my favorites parts of the city. Tons of restaurants and bars and people. Around the corner from public transportation. I highly recommend this apartment for your stay in Athens.
240960,3315095,2013-01-09,961751,Noah,Liked it so much I came back for more!
240960,12643741,2014-05-06,7828426,Xanthos,"Yianni was a great host, everything was just perfect. We really enjoyed the psyrri area of Athens but his loft design was some of the best we have seen in the world. Amazing experience will recommend it to all our friends!!!!"
240960,14156380,2014-06-13,5999464,Fahad,"So we really enjoyed our stay at Ioannis's apartment, the apartment is very big and the furniture is eccentric, we loved it. Everything works properly. Ioannis is a very nice guy and he lives next door. He is very helpful. Overall highly recommended."
240960,14294823,2014-06-16,7072232,New,The apartment is very nice and we had a great stay in Athens. Ioannis is a great host.
240960,14784782,2014-06-26,9227683,Sefi,"The  apartment is great located and beautifully decorated!
Ioannis is a great person , so it makes everything even better..
We will come back soon"
240960,15074330,2014-07-01,14286254,Gregory,"This flat is really well located in the heart of Athens. The flat was great, clean with everything you need. This place is also magic with all the artistic decoration. You could feel in NYC being in Athens.
If I come back, for sure I'll go back to Ioannis place"
240960,15193551,2014-07-04,208329,Abigail,"I highly recommend Ioannis' flat for anyone staying in Athens. My traveling companion arrived from another city to check-in to the apartment before me. Even though this complicated things a little for Ioannis, he was perfectly gracious and helpful and made sure everything went smoothly. The apartment itself was clean, stylish, and very quiet---despite being above a lively street in Monastiraki (filled with locals, not tourists). There were 3 of us total, and we were very comfortable. The location is truly the best part; you are a short walk away from great sites, restaurants, metro station, shopping, etc."
240960,15706660,2014-07-14,3588570,Maria,Amazing Apartment! Totally recommended to anyone else to rent it.
240960,15882431,2014-07-17,6091904,Ania,"The apartment was great. So much style that even my 10 and 13 year old kids that it was the coolest place ever! Location was convenient right off of mastriaki square, and steps away from restaurants, shopping, etc. Anna and ioannis were responsive and very friendly. Fantastic experience and would not hesitate to recommend.
"
240960,16557307,2014-07-29,16599788,Ayanthi,The host was very hospitable and understanding as we were running late and got slightly lost! The Apartment was better in person than in the photos. The location couldn't have been better and was walking distance to the Acropolis site and there were lots of bars and restaurants on our doorstop. All in all an excellent experience in an amazing apartment!
240960,16975574,2014-08-05,13230032,Dan Fredrik Clemp,"Ioannis met us at the door when we came and showed us around the apartment. It was clean, well air-conditioned (which was important given the temperature outside) and surprisingly well isolated against outside sounds. It's located in a very busy street with loads of bars and restaurant, yet we barely heard a sound, even with hundreds of people outside.

The apartment in itself is spectacular - I estimate about 100m2 centrally located in Athens, just a short walk from everything we wanted to visit. The interior is what drew me to book the apartment in the first place and it did not disappoint. I think we could have stayed for another week and still keep discovering new things about the furniture, art and details.

I'll definitely book this place again if it's available the next time I'm going to Athens."
240960,17534950,2014-08-13,3299110,Ann,"Great location; convenient.  Spacious apartment; we had three people but the space would have been adequate for more people.  Didn't get a chance to meet Loannis, but he had someone wait for us at the apartment.  Responsive to e-mails."
240960,18128185,2014-08-22,8196346,Yiorgos,"A unique flat in a very convenient location. Very close to the metro and all the happening place of Athens. Spacious and tastefully decorated.
Ioannis was very friendly and put every effort to make our stay pleasant. "
240960,20480959,2014-09-29,1381708,Ramiro,"The apartment is amazing!
It is located in the heart of Athens. Very well connected. Perfect if you want a good location and good atmosphere also at night
Ionnnis has been a great host: he allowed us to leave our bags very early in the morning and let us go on the last day late. It has been very kind and friendly
A perfect choice to spend a few days in Athens."
240960,21635309,2014-10-20,3101308,Stephen,"I had a great stay at Ioannis' Designer Loft in Psirri.
Ioannis was a great host - friendly, easygoing and very hospitable, sometimes going beyond what was expected to make sure my stay was comfortable and that I had everything I needed. As can be seen in the photos, the pad is something a little bit special and definitely very cool but also very comfortable with good facilities a very comfortable bed and everything else I needed - and even an awesome grand piano (which I made full use of!)
The location is A1 - particularly for the young (and young at heart) - right in the middle of Athens' most vibrant entertainment precinct - and also just minutes from Monistariki, Plaka and the ancient ruins of the Acropolis. All great!"
240960,25005134,2015-01-05,12661633,Hiromi,"The apartment was definitely THE highlight of our visit to Athens. It's way better than described or the pictures show. We're still wondering why Ioannis doesn't charge more for this truly unbeatable place... First of all, it's huge. Really huge. Great location. Many restaurants, bars, convenient stores, metro station (Monastiraki), main shopping streets and most of the sights (e.g. Acropolis) within walking distance. The flat is clean and cozy with a tasteful interior design. It offers EVERYTHING you need and even more. I haven't seen any other apartment in Athens but I can promise that this is the best one."
240960,30625971,2015-04-25,30365708,Anton,"5 star loft!!!. Ioannis place is better than advertised. If you are gojng to athens you have to stay here. The loft is better than the pictures provided. You can't get any better than this location. A short walk to Acropolis and all the shopping so close. All the bars and restaurants next door provide a real Greek experience. Ioannis met us as we pulled up and gave a great tour and showed us everything in the flat. Not only was he really friendly he provided water, juice and beer upon arrival, now that is a great host. I highly recommend this place to anybody that wants to have a great time in Athens! Would definitely rent again. Once again, Thanks for a wonderful time."
