listing_id,id,date,reviewer_id,reviewer_name,comments
155271,6363765,2013-08-10,493822,Laura,"E' la nostra prima vacanza con airbnb e l'esperienza e' stata ottima.
L'appartamento di Roula è esattamente come descritto dalle foto, accogliente, luminoso, molto personale, attrezzato per ogni necessita' e pulitissimo.
Ha un bel terrazzino che affaccia sul verde di una ambasciata.
La location e' perfetta,è vicino alla metro che porta sia in centro che all'aeroporto.Facendo una passeggiata siamo andati al museo bizantino, al museo Benaki e poi fino a Monastiraki.Atene vi aspetta per essere scoperta e questa casa e' una ottima base per cominciare.
Roula,la proprietaria, e' una persona gradevolissima che vi consigliera' al meglio, e' come una fatina che vi aiutera' a vivere la favola!
Roula parla un eccellente italiano per cui la comunicazione e' facilissima e veloce.
Ritorneremo."
155271,6535729,2013-08-16,5489697,Tom,"Roula was a very kind and informative host. We arrived quite late into Piraeus port, Roula gave us detailed written instructions in English and Greek to give to the taxi driver to get us to the apartment. The apartment was clean and spacious enough for a couple and a third wheel. The place is a few minutes walk to the bus stop, where there are many services into town ( including the x95 which goes to the airport). Thank you for the stay."
155271,6866231,2013-08-28,3342930,Jeny,We had a wonderful time while we stay in the Roula's Apt. It's a cozy and beautiful apt as it shows in the picture. Roula is the best host that take care all we need. The apt is convenient to the most attractions. Thanks Roula!!!!
155271,7008731,2013-09-03,6946106,Rosemary,"Roula's place is very centrally located -with a Metro stop nearby. She was very helpful from the start, sending lots of information about where to shop, eat and explore.  She met me when I arrived and had tea and cookies as well as a bottle of wine for our stay.  Her place is very relaxing and we felt at home the entire time.  I would visit again and recommend her highly."
155271,7113171,2013-09-07,6550511,Laura,"I stayed in Roula's Athens apartment for 3 days with 3 friends. We had a very enjoyable stay! The apartment was very close to public transport so it was easy to get to the airport and the landmarks e.g. the Acropolis. It was also very homely, with lots of personal touches, including biscuits and wine in the kitchen provided, and plenty of toiletries for us to use.

Roula really went above and beyond to help us out, even though we never met in person. Before we arrived, she sent us a list of activities and places to eat in Athens. I also had trouble booking train tickets to my next destination and she kindly allowed me to have them sent to her private address, where they were then hand delivered to me by her daughter on arrival. Could not have asked for a more genial host!"
155271,7223061,2013-09-11,3143622,Genevieve,Roula was amazing and stayed in communication the whole time. The location is amazing and so convenient to get whatever you need. The apartment was immaculate and well kept and really made us feel at home. Can't wait to go back so we can stay again
155271,7289790,2013-09-14,3779139,Ricardo,"We stay just for 2 nights but we really enjoyed. The apartment is very nice and cozy, well equipped and conveniently located. Ralou and her daughter Joanna take care of us... Thanks a lot!"
155271,7303150,2013-09-15,7496095,Ann Kathleen,"I wholeheartedly recommend staying at Roula’s apartment in Athens. It is in a nice neighborhood and easy to reach from the airport by metro or bus. It is perfect for a couple and it is nicely decorated with some very excellent paintings on the walls. I particularly enjoyed waking up to a lovely landscape in the bedroom and I also adored the curtains in the living room (I love fabric). The apartment is quiet and my husband and I slept very well—important so that you get the most of visiting Athens by day (and well into the night!). While I did not get the chance to meet Roula (hopefully on another occasion), we were in regular communication from the day we made the reservation and she provided us with a wealth of information. Her recommendations are excellent. We followed her lead on several occasions and really appreciated the information. Roula’s warmth and desire to share her city was evident in our exchanges and I can’t wait to visit again.

Kathleen Valencia"
155271,7417995,2013-09-19,8001173,Adriana,"Roula is a perfect hostess! the apartment is beautiful and well-equipped. the location is very good!
decoration adorable! and very well kept!
Roula and her daughter are very kind! He was always very attentive to any need we could have!
everything everything, everything! Perfect! thanks a thousand times!"
155271,7724032,2013-09-30,6686592,Julie,"Ralou est une hôtesse gentille et très attentionnée . Son appartement est propre, très confortable, tranquille et il est bien situé (à 5 minutes à pied du métro et de plusieurs services). Loger chez elle fut une expérience positive que je recommande fortement."
155271,7844950,2013-10-06,4914440,Bee,"Our host was amazing from the moment we confirmed our booking. Ralou sent attachments with directions to the apartment, things to do and transportation. Her communication was very prompt, directions accurate and precise. The apartment was gorgeous, well maintained, and the bonus was little touches like the welcome yogurt and honey, there were biscuits, toiletries and etc. We felt right at home. Great base for Athens!!"
155271,7952936,2013-10-09,7136973,Jennifer,"Great hosts, great apartment and location. "
155271,7995935,2013-10-12,6340435,Rod,"      We spent 3 nights in Ralou's apartment and found it ideal for our situation.  It was big and spacious with a nice balcony to sit out on. We found it quite clean and well furnished.  We were able to catch up on our laundry needs with the in apartment washing machine and then use the drying rack on the balcony.  Enjoyed 3 of the several movie DVDs as well.

Apartment is located in a good neighbourhood with a Metro stop within easy walking distance.  There are several market  and grocery stores nearby as well as restaurants to choose from.   We prepared our own evening meal twice with the well equipped kitchen.  Ralou provided a wealth of information about the immediate area as well as city highlights.  She was very accommodating to any of our inquiries.  We would definitely use this location again."
155271,8037463,2013-10-14,889230,Ivan,Ralou's apartment is pretty cute and well located. Easy to access to the airport via bus. recommended!
155271,8207855,2013-10-21,6454339,Jennifer,"Ralou was a most gracious host, and who provided us with lots of information about her flat, suggestions re. places to vist in Athens.  The flat is beautifully decorated and ideally located.  We felt very, very welcomed!  I would highly recommend a stay at Ralou's flat for anyone travelling to Athens!"
155271,8386503,2013-10-28,9363886,Marina,"Ralou is a wonderful and a kind host. I arrived very late at the apartment and she was there waiting for me! The apartment itself was super, exactly like in the photographs! I stayed at Ralou's apartment, which is located in a central and safe area in Athens and made my trip an enjoyable, fun and easy experience. I give it 100% feedback! A small gem for the one that seeks good hospitality, clean and quiet space. The veranda overlooking the gardens is a treat!
Thank you Ralou mou! Would love to stay in your apartment again and again and again! "
155271,8464221,2013-11-01,2219261,Chrysa,"The Stylish Apartment in the heart of Athens is an exceptional one. We enjoyed every moment staying there. Everything is near by, metro, buses and walking distance from lovely cafes. It gives the sense of the city center plus the elegance element. It is very clean and functional. The living room is cozy and the house in general is bright with big windows and balconies. We would love to come back one day Ralou, thank you for having us, I highly recommend your lovely apartment to your next guests. :-)"
155271,8887169,2013-11-24,8098277,Irini,"I cannot thank Roula enough for her wonderful hospitality!!! She is such a kind and warm person and it was such a pleasure meeting her! She made sure we had everything we could possibly need and invited us in her property like family! The apartment is in an amazing location and it covers any need you may have! Clean, spacious, bright, decorated so tastefully, it makes you feel like home! One of the bonuses of it is the balcony which overlooks a beautiful garden with many fruit trees! Makes you feel like you are escaping the city! We will definitely come back to stay at Roula's and we are happy to always say that this was our daughter's first home! :-) Thank you for everything! xoxoxo"
155271,9467060,2013-12-30,2462192,Maria,We had the best time in Athens and we owe much of that to the fact that Ralou allowed us to use her apartment. The location is perfect! The apartment is clean and comfortable and immediately we felt very much like home. The bed was comfy and generally the whole apt has everything that you could need! The couch was absolutely comfortable.The apartent is in a central and safe area close to the metro station. I have no words for Ralou. She is by far the best host we ve ever had! Sweet and ready to help with everything we needed! I highly recommend it. Go for it and you wont regret it! Ralou a HUGE thank you for everything! Hope to see you soon!
155271,9809883,2014-01-11,11070269,Giorgos,"i stayed for two nights at Ralou's place, me & my girlfriend,a week ago. Ralou is very cool and friendly. The apartment was as i expected.we really enjoyed it! "
155271,10082357,2014-01-29,1638674,Sergey,We would like to thank Ralou for her hospitality. She is making sure everything her guests need is there for them. She also goes beyond the needs with some little touches. Highly recommended host.
155271,10464322,2014-02-20,6897118,Cliona,"We had a perfect stay in Ralou's lovely apartment in Athens. Ralou is the most wonderful host, she gave us a fantastic welcome and the information she provided us with on the local area and beyond was second to none, restaurant to beat the band, exhibitions, walks you name it! The apartment is so well equipped, centrally located and very comfortable. Ralou's communications are very prompt and she is a really great lady! Thank you Ralou for making our trip to Athens!"
155271,10719236,2014-03-04,3279896,Ben,"We had a wonderful stay in Athens with Ralou. The apartment is lovely,in a great location,both for visiting athens and accessing the airport. The apartment is even nicer than the photos suggest. We had a lovely lunch of wild asparagus with feta and grilled tomatoes (from a great green grocers nearby) on the balcony,overlooking the olive and lemon trees in the garden below. Ralou is kind, thoughtful and beyond helpful. This was one if the best holiday experiences we have had. We will definately return,and stay with this lovely lady. Thankyou Ralou, you made my partners 40th birthday an amazing experience. Xxxxxxxxxx"
155271,11194710,2014-03-24,1917758,Nikki,"Great apartment. Good location, clean and tidy and really nicely done out."
155271,11612667,2014-04-09,6154085,Motoko,"Ralou’s condo was fully equipped for everyday life. The kitchen, bathroom, bedroom, living room and dining area were clean, organized and efficient.

The location was excellent: close to Metro station, bus stops, grocery stores, pharmacies, bakeries, bars, coffee shops, banks and much more.
During our 2 weeks stay, we walked to the coffee shop after dinner and stayed until 10 pm many nights. Walking around the condo at night was absolutely safe.

Before our arrival and during our stay, Ralou constantly sent us detailed information of places to go, things to do, things to watch out, reminders, etc. She is truly SUPER HOSTESS!!

We will go back to Athens and will book her condo again in the future.
"
155271,11859665,2014-04-17,4775227,Patricia,"I spent two nights in Ralou's apartment with two friends.  It was perfect for our needs as we wanted to do a whistle stop tour of central Athens.  The apartment was well equipped for all our needs, thank you Ralou!"
155271,11963062,2014-04-20,13434726,Jacqui,"We had a wonderful stay in this apartment with such great tips on things to do, places to go from Ralou. Highly recommended.
"
155271,12136393,2014-04-23,14137052,Madison,Ralou is the nicest women ever! She has everything you ever need at the apartment. I could not have stayed at a better place!
155271,12406179,2014-05-01,13879008,Christian,"I spent 6 days in April 2014 in Ralou's apartment. One word to sum it up : perfect ! It's a very nice apartment, corresponding to the pictures online, clean, with enough space for at least 3 persons, a nice balcony for the afternoon/evening sun, calm, and Ralou is a wonderful host, very helpful and rapidly responding if there's anything you may need. Supermarkets, bakerys etc are very close to the apartment, as well as metro and bus stations, which makes it very easy to visit Athens. If you prefer walking, no problem at all, the apartment is close enough to everything, I highly recommend as a start to walk to Kolonaki square and up Lycavittos hill, where you have a wonderful view on Athens."
155271,12699814,2014-05-08,14649303,Bernadette,"Great apartment, handily located a five minute walk from the blue metro line which is only two stops from the city centre. The apartment was clean and tidy and close to all the amenities we needed during our stay (supermarkt,  bakery). The apartment is located in a calm and safe area. Ralou was a lovely host, she answered any questions we had immediately and provided us with plenty of sightseeing material and maps. We would definitely recommend this apartment to friends and family looking for a good place to stay while seeing the sights Athens has to offer."
155271,13193886,2014-05-21,15151513,Ivan,"Amazing apartment and host. The apartment is easily accessible by metro and near all the amenities of this great city, but is, at the same time, very calm and cozy, with an almost rural soul. Every morning, I'd wake to birds singing !


As for Ralou, she's knowledgeable, always ready to help, speaks many languages, and is a gracious person overall. "
155271,13534029,2014-05-30,5971488,Ingo,"Ralou gave us a very warm welcome.
During the stay, all kind of questions (e.g. regarding activities, restaurants, go out, ...) we asked, she has answered immediately.
The Kitchen was filled with many different dainties, like home made jam, olive spread, new bread, wine, melon, strawberries, cookies, ...
The Apartment is very cozy, we felt very comfortable.
It is is very well equipped, especially the small things Ralou provided for all contingencies gave us the feeling to be at home.
Thank you so much Ralou, Uta and Ingo!
"
155271,13783545,2014-06-04,13464605,Adria,"Ralou is a fantastic host. Very helpful and accommodating. She provided is with plenty of information in regards to getting to the apartment and must do's/eats in Athens.
The apartment is lovely and is even stocked with shower products and other necessities. Will definitely stay in Ralous apartment again if back in Athens. Thanks Ralou!"
155271,14193611,2014-06-14,10184677,Erin,"Our stay here was wonderful! Our host, even though she was out of country, arranged everything for us! She had a taxi pick us up and take us right to the apartment! Everything was taken care of for us, I highly recommend staying here and with this host!"
155271,14774280,2014-06-26,13820196,Nina," We had a fantastic time! The apartment is very nice and in a very good neighborhood, lots of nice Restaurants, a great Bakery and Shops. Our host was fantastic and provided us with everything you could ask for! We will definitely come back!:)"
155271,16240133,2014-07-24,1577922,Anna,"this space was wonderful!  it's situated in a beautiful spot in athens.   in the platia mavilli section of the city - there's a square filled with trees which makes it wonderful to sit out in the evening or in the morning and have coffee or wine with great food!  everything you need is within walking distance of the apartment, including the metro which will take you anywhere you need to go in the city and beyond.  it's superb"
155271,16959848,2014-08-04,2983976,Sercan,Ralou is the most amazing hosts ever. She managed everything in the house extrenly well. Her house is pretty good for 3-4 day stay. The center of Athens is a bit confusing as where you define center is. If you think center is Akropolis you need to take a 4 euro taxi from the house. House enviroment is so good you can reach to many places market bakery shopping area etc. very easily.  If you have a ca there is no car parking problem. The only thing is you need to be quiet for the neighbours...
155271,17145105,2014-08-08,14809743,Brian,"Very comfortable apartment in a nice neighborhood. Good amenities nearby, and easy access to the tourist areas. Ralou is a great hostess. She arranged transport for us from and to the airport, and provided many local insights for restaurants and shops. She was very responsive and helpful. We would definitely stay in one of her units again!"
155271,20132718,2014-09-24,12262570,George,"A very nice, clean apartment, centrally located for easy access to most of Athens. 4 euro taxi rides will get you most anywhere...10 minute walk to metro...main bus route to Acropolis just a walk to the corner.  Off the main thoroughfare enough to give you a quiet peaceful rest.. Easy access to local markets and restaurants.  You really can't miss with this rental. Lots of tips from Ralou that are right on target"
155271,20405257,2014-09-29,12687723,Mario,"We had a great time in Athens! The apartment is conveniently located within a 15 minute walk of the metro station and there are a couple of supermarkets close by in case you need to buy something. Ralou is very helpful - her travel tips are really useful - and she was kind enough to stock the fridge with a lovely breakfast and a four pack of beer (a nice thing to find when you arrive after a long flight at 10 in the night). I would certainly recommend this as a great place to stay, especially for small families. "
155271,20870328,2014-10-06,14091835,James,"The apartment is in a great location and very close to the metro and buses but within walking distances to a lot of places. Ralou left a folder with tips on local restaurants and Mr Baker nearby with is a wonderful bakery. The apartment is very quiet with a nice deck in the sun. It was very clean and comfortable. We thoroughly recommend it and if we go back to Athens we would have no hesitation in staying there again.

Thank you again Ralou, you are a wonderful host
"
155271,21059420,2014-10-10,22087025,Maria,Η περιγραφή ήταν ακριβής  η γειτονιά πολύ καλή και η οικοδέσποινα έκανε τα πάντα για να νιώθουμε σαν το σπίτι μας
155271,21631088,2014-10-20,14705641,Patti,"Ralou responded to my emails very quickly and sent, in advance of our arrival, detailed information about Athens, our flat and our neighborhood including places to eat, things to do and had a special gift waiting for us! She was unable to meet us herself but arranged for a knowledgable and helpful person to assist us when we arrived.  Ralou was extremely accessible and made extra efforts to communicate - calling us shortly after our arrival to make sure everything went smoothly.  The apt. Was very quiet especially considering how close we were to a very busy, high traffic, main thoroughfare. It was nicely appointed and clean.
"
155271,21940333,2014-10-27,18243772,Dawn,"From the initial contact to the very last minute I knew that I was in for a special experience. Ralou took care of my every question and request, from helpful ideas on where to visit, organising me a taxi transfer on arrival and putting lovely coffee and fruit in the apartment for my convenience.
The location is perfect, a half an hour walk into the centre of the city with a metro and all that is needed nearby.
The apartment is beautifully appointed and every consideration has been taken to ensure a comfortable stay. Great wifi! And the sunshine that comes in throughout the day makes for a happy welcome feeling. As does the balcony and garden below.
I wouldn't stay anywhere else in Athens and hope to return for a longer visit next time. Thank you so much for welcoming me like a friend! Loved your city. And highly recommend your apartment to any visitors to it."
155271,24078230,2014-12-19,12192555,Emily & Alex,"A stay at Ralou’s was the perfect introduction to Athens. We were greeted with a plate of Greek Christmas cookies and a phone call from Ralou to ensure we had arrived safely. We appreciated her tips (especially about where to eat) and her attentive communication before and during our stay.

The apartment is a beautiful blend of old and new. The best feature is the balcony overlooking a garden, which we were able to enjoy even in winter. Despite our short stay, we truly felt at home thanks to Ralou’s hospitality and would happily stay again. Σας ευχαριστώ πολύ!
"
155271,26478838,2015-02-14,23200102,Eleni,"Ralou kept in touch to ensure I was comfortable and had everything I need.
Listing was accurate - a lovely and cosy apartment, close to everything.
"
155271,27123347,2015-02-26,10782628,Audrey,"The apartment was comfortable and in a great location 5 minutes way from the Athens convention center and a pleasant 40 minute stroll to the sights and downtown. Ralou provided so much information before our arrival and took care to contact us after, we always felt we were in really good hands. She was a pleasure to deal with from beginning to end. Bed was incredibly comfortable and the apartment was clean and well stocked with everything we need for a 4 day business trip. "
155271,29171651,2015-04-05,24613811,Rachel,"Very comfortable apartment in an excellent area in easy walking distance of shops, restaurants, banks, bus stops (very close to the airport bus stop) and metro line into central Athens.

Ralou was away when we arrived but made sure we were greeted warmly on arrival and then rang us as soon as she was able to ensure everything was going well.

The bed is very comfortable, the living/dining area very stylish and I enjoyed a few hours, reading some of the books provided, on the sunny balcony which overlooks a nearby garden.

The small kitchen had pretty much everything you could need,
even including a selection of tea and coffee, and the shower room was clean and the water kept warm for some time after heating.

All in all a good choice!

"
155271,31314244,2015-05-04,2204326,Petra,"Een fijn appartement in een fijne buurt. Schoon, netjes, rustig. Ralou zorgt ervoor dat haar gasten zich snel thuisvoelen. We komen zeker terug. "
155271,32370611,2015-05-17,21394594,Carole,This was our first visit to Athens (for a conference at the Hilton Hotel) and we were very pleased with the location and amenities of Ralou's apartment.  The kitchen was well equipped and the washing machine was a lifesaver during the week.  The balcony was glorious for relaxing under the Athens sun while enjoying a glass of wine after a long days of sightseeing/conference.  The proximity to the Metro and airport bus stop was ideal and within walking distance to the Hilton Hotel.  Ralou greeted us as family and provided a wealth of local information before and during our stay.  This is our fourth Airbnb and the experiences continue to be memorable.
155271,35561918,2015-06-20,4203218,Christine,Ralou was the perfect host. Responses to emails were immediate and she provided me with lots of valuable information in advance. She and her lovely daughter welcomed me warmly at the appartment. The flat was very clean and the location was perfect for attending a congress at the Megaron Center and just a few stations away from the city centre. I highly recommend this place!
155271,36047604,2015-06-24,35392290,Vanessa,"Our stay was wonderful. The apartment was exactly as described and was clean, neat, and ready with every detail you can think of. There was tea, instant coffee and 2 types of cookies to greet us (wonderful as we were so hungry when we arrived on Sunday evening and every market closed!). Steps from all bus lines and metro service around entire city. For Americans it is also good to note that it was close to the American Embassy (we did not go there) and for Serbians, it was also close to Serbian embassy (among other embassies) so we used those locations to navigate our way back to apartment. I would definitely stay here again as everything was perfect and Ralou and her daughter were so hospitable and kind! "
155271,37032489,2015-07-04,26984712,Bianca,"Excellent communication throughout stay and before. Great apartment close to Metro and shops, would highly recommend."
