listing_id,id,date,reviewer_id,reviewer_name,comments
1824675,28353143,2015-03-22,17321138,Megan,"Christos was an excellent and very generous host for our stay in Athens. His shared house is extremely unique and the balcony his a perfect spot to drink a coffee and have breakfast. The location is perfect for walking to the Acropolis or the Sunday Flea Market and has some great restaurants and cafes just a short distance down the street.

Our host greeted us then provided a map and some great information about where to go. The room we stayed in was next door to Christos' room, but we barely noticed that he was there. He provided everything we needed such as towels and a clean bed. The room was a little bit cold and faces a very busy street, so at night we could hear lots of cars right outside the window. There were a few minor issues that weren't what I expected, such as the door to the bedroom is very loud, no shower curtain in the bathroom and the house being a little bit cold. Other than that Christos was an extremely gracious host and location was ideal.  We walked ~15 min to the train station the next morning to catch the subway to the airport (14 Euro for 2 tickets)."
1824675,29034857,2015-04-03,7261404,Saskia,"Ich hatte mir vorher die vielen, sehr positiven Kommentare von Christos' Unterkunft durchgelesen und war selbst auch zufrieden. Das Abholen von der Metro hat gut geklappt, das Zimmer und die Gemeinschaftsräume (Küche, Bad, Flur, Terrasse) waren sauber und einladend gemütlich. Man hat gemerkt, dass sich Christos wirklich beim Einrichten des Gästezimmers und der Wohnung, aber auch als Gastgeber selbst Mühe gibt. Da ich mit meinem Freund fast zwei Wochen bei Christos war, haben wir auch mitbekommen, dass er das Bad regelmäßig putzt und die Küche immer für uns nutzbar hinterließ. Einige Lebensmittel durften wir mitbenutzen oder wurden dazu eingeladen etwas mitzuessen. Er war sogar etwas böse, als er sah, dass wir Beuteltee gekauft haben, obwohl er noch so viel losen Tee von dieser Sorte hatte, den wir ruhig mittrinken durften.
Am Ankunftstag gab uns Christos eine kurze Orientierung und ein paar Tipps zu Athen, weil wir zum ersten Mal da waren und auch einige Fragen hatten. Auch wenn wir sonst irgendein Anliegen hatten, von denen es jedoch insgesamt wenige waren, war er immer hilfsbereit. Ansonsten ließ er uns völlig unser Ding machen und zog sich eher zurück, als dass er für uns immer präsent war."
1824675,29596387,2015-04-10,13867339,Sandra Patricia,"Christos es un increible anfitrion. Nos ayudo a llevar las valijas por la calle hasta llegar a su casa y nos guardo el equipaje por cuatro dias mientras fuimos a las islas (ya estaba acordado). El dia que volvimos cocino para todos (riquisimo!!) Debido a que llegamos tarde. La casa es muy comoda. Tiene habitacion y living privado y el baño tambien es privado solo para huespedes.  Es muy recomendable tanto por la casa en si, como por su anfitrion."
1824675,29905998,2015-04-14,22273790,David,"Christos was very welcoming and provides lovely accommodation close to all transport connections.

Property close to all attractions of Athens in a safe area."
1824675,30084154,2015-04-17,29018749,Lieve,"Kristos picked us up at the metro although his apartment is not so far and easy to find. We felt very welcome from the start. The two rooms were  very clean and nice.   Kristos gave us very useful information about the city, restaurants etc.  he also gave us a map.  His apartment is very  good located to visit Athens, just a few minutes’ walk and you are already in the Acropolis area.
Our children felt very comfortable and liked the rooftop very much.  Kristos is a good host,  he was there when we needed him, but was also very discrete.  We absolutely recommend Kristos and his apartment!
"
1824675,30400691,2015-04-21,28873991,Meri,"Christos was very nice, he picked us up from the airport and drove us to his house, where he gave us a map and showed us where the nearest places to see were. The room was very comfortable, clean and walking distance from pretty much everything we wanted to see. Absolutely recommend staying at Christos' house, even though we were there for only two days! "
1824675,30464556,2015-04-22,27841733,Brock,"Listing was very accurate and the apartment was very much as shwon in the pictures - wonderful details in the house - I felt like I was getting a very true picture of an Athenian house of this time period and location.
Christos was a wonderful host who went way beyond the call of duty without even being asked.  He accompanied us to two different subway stops and was kind enough to share music from his collection with me!  -- a kind and artistic soul with a great ""green thumb"" and skill at growing plants.  His apartment has many wonderful decorating touches and the location is extremely convenient to both the temples of the Acropolis and Filoppapou  Hill and to the main subway lines.
I would love to return and stay with Christos for a longer stay with more time to explore Athens and hear Rembetika!
Thank you, Christos! "
1824675,30796849,2015-04-27,5659019,Sasha,"Christos was wonderful! His place is well located, and the room is massive. walkable distance from acropolis. Super safe area. I defiantly recommend this place! "
1824675,31027679,2015-05-01,22161351,Joris,"We, my son and I, had a very pleasant stay at Christos place. The location is perfect, close to the centre yet out of the mainstream tourist area. Good local bars and restaurants. The apartment is spacious and light with a nice and personal interior design. The roof terrace is great! Christos keeps his place very clean and gives us a lot of privacy. All together I certainly recommend this place to other travellers."
1824675,31165318,2015-05-03,26405218,Patrick,"Plusieurs éléments nous ont fait sentir que nous étions les bienvenus.
Christos nous a accueilli sur le pas de sa porte à 23h, nous a aidé à monter les bagages et ensuite nous a fait découvrir le quartier et malgré l'heure tardive, nous a accompagné dans un restaurant plein de charme qu'il nous a choisi.
Le logement a bien été décrit, nous réservant de belles surprises.
Le quartier tranquille nous a beaucoup plu et nous avons trouvé quelques rues plus loin des restaurants typiques aux menus savoureux et à des prix très raisonnables."
1824675,31507569,2015-05-06,26546317,Floris,"We visited Athens for three days with a family of two adults and two children.
We were welcomed by Christos at the metro station and he took us to his house. We had two rooms and could use the kitchen. But the best place was the roof terrace, with all the beautifull plants Christos is keeping there.

The house is in a neighbourhood wich is not touristic, but quite near all the places you would like to visit. Acropolis can easily be reached by foot.

Christos is a very friendly man and made us feel welcome. He gives advise, but also gives you your own space.

This was our first aribnb, butafter this very pleasant experience, we will defently do it again.

Thank you Christos.

Petra, Floris, Merel, Nienke."
1824675,31783121,2015-05-10,5277653,Celine,"Highly recommended.
The neighbourhood where the apartment is located has a real alternative and laid back charm to it. Friendly people, chilled bars, authentic restaurants with delicious native food.
Actually you can say that about a lot of Athens. Totally exceeded all expectations. Incredible city. A real mix of history and cosmopolitan city life.
So much to see and do we didn't spend a great deal of time in the apartment but it suited us perfectly. Large room. Clean and tidy. And Christos is a great host. He's available when you need him but gives you all the privacy you need/want.
We would certainly return and would recommend the neighbourhood, Christos apartment and the city to friends and family."
1824675,31933433,2015-05-12,290387,Bob,"Cristos was wonderful, the perfect airbnb host!. He watched for our taxi and came out to help us with our bags when wee arrived. As others have said, he was friendly and available but never interfered with our privacy. Our stay in Athens was very brief but it was great to walk from Cristos' place to the Acropolis! The roof garden is really charming; an oasis on a hot day."
1824675,32444551,2015-05-18,8368154,Hansjörg,"Christos hat mich freundlich und hilfsbereit empfangen. Das Zimmer ist gross und die Dachterrasse wunderbar. Das Haus ist mit der U-Bahn gut erreichbar (ca. 10 min zu Fuss). Das Quartier ist eigentlich ruhig, nur am Wochenende hört man in der Nacht Autos und Motorräder vorbeirasen."
1824675,32749360,2015-05-21,18205765,Robert,"Christos met us on his bike and was so warm and welcoming.  His house is a bit tricky to find, but our GPS helped.  Such an oasis in an excellent location!  We loved the rooftop garden.  The character of the neighbourhood is so pleasant and walking distance to all of the major attractions.  Christos cooked us an excellent Greek meal and showed us around."
1824675,33440105,2015-05-28,7006818,Karen,"Christos' place is exactly as described.  The bedroom is large with a comfortable bed, and the attached sitting room is quite spacious.  There are two large windows and a small balcony.  Everything was very clean.  Christos is a warm and welcoming host, we were two females and felt safe and secure.  The shared kitchen and bathroom are perfectly easy to navigate with no awkwardness.  The roof top garden is the gem of the place, we simply loved it.  I would stay with  Christos again without hesitation. "
1824675,33764055,2015-06-01,24978516,Katherine,"Christos was a great host! He was very welcoming and provided us with a map and great information. The room was spacious, and we had everything we needed for a wonderful weekend in Athens. The rooftop was also amazing. Thanks Christos! "
1824675,33986582,2015-06-03,26000818,Philippe,"Christos nous a bien aidé, y compris pour arriver jusqu'à lui, son accueil a été chaleureux, il nous a tout de suite offert des boissons.
Il nous a expliqué le quartier qui est proche de l'Acropole.
Nous recommandons vivement cet hôte aux autres voyageurs."
1824675,34425224,2015-06-08,29378332,Meg,"The room itself was absolutely great (clean, comfortable and roomy) and as it was a very hot night we really appreciated the fan. The rest of the home was a little grimy for my family's liking. I did not pay attention to the fact that our room did not have a bathroom and so our bathroom was shared with the host. That made my husband crazy. I'm not as picky as my boys are though so I was fine with it and thought our host was helpful and low key. He walked a considerable distance to help us when we got ourselves lost coming from the train station. He let us keep our bags in his living room while the room was getting prepared. My only complaint was that we weren't able to get in to our room until after 5pm and we were super tired from an early flight and would have loved a short nap before heading out to explore Athens. "
1824675,34736458,2015-06-11,16969435,Greg,Very nice place. Beautiful rooftop garden. Christos is a great guy with lots of tips for things to do in Athens!
1824675,34977230,2015-06-14,28185131,Andrew,"Christos is a really awesome dude and host, made us feel at home, told us cool things and just a super nice guy.
His place is amazing! The roof top is incredible and the rooms are really big. Perfect location too.
Only negative is that the road it pretty noisey but just take some ear plugs - the noise is definitely worth it for the place."
1824675,35839194,2015-06-22,31661090,Joan,"Al arribar, el Christos va ser molt atent amb nosaltres, situant-nos al barri, recomanant llocs per anar a menjar, per on sortir, on anar a passejar i a quines hores... en fi, es coneix perfectament la zona i els seus consells són més que fiables. El barri està molt i molt bé: ideal per sortir a menjar a preus molt raonables i a un agradable passeig a peu del centre.
En definitiva, un lloc perfecte per quedar-se a dormir un parell de dies si sou quatre persones ben avingudes, ja que les dues habitacions són contínues.

"
1824675,36056884,2015-06-24,35879309,Kori,"We had a really great time staying at this apartment in Athens. It is in the most perfect location, close to the ruins, great shopping, and really great local restaurants. You can completely avoid the crowded downtown area of Athens by staying at this apartment. The apartment itself was very nice and clean with an amazing roof top deck. I would definitely recommend this apartment. "
1824675,37075291,2015-07-04,6605360,Céline,"Appartement confortable, très bien situé : colline des Muses à deux pas pour un un peu de fraîcheur avec vue sur l'Acropole, métro tout près.
Accueil parfait malgré un fort retard, et conseils très avisés en français."
1824675,37577908,2015-07-08,34757446,Laurent,Excellent accueil. Terrasse magnifique. Quartier idéalement placé près de l acropole mais bruyant. Pour moi c'est vraiment une excellente adresse pour découvrir athènes.
1824675,38012390,2015-07-12,32143877,Tania,Wir wurden sehr freundlich in Empfang genommen und haben tolle Tipps für unseren Aufenthalt in Athen bekommen. Die Wohnung ist großzügig mit einer wunderbaren Dachterrasse und ihre  Lage ist großartig - die Akropolis und Umgebung sind super zu Fuß zu erreichen.
1824675,38312305,2015-07-14,6489936,Helene,Merci christos de nous avoir offert ce beau pied a terre a 2 pas de l'acropole et du metro pour l'aeroport et merci a l'ami jason pour les bons conseils et l'accueil super chaleureux!
360940,6498710,2013-08-14,32329,Gokhan,"The.flat is design at its best. The vintage furniture Dimitrios collected is in excellent shape and adds a very elegant touch to the flat. We were very comfortable and we felt most welcome. If you would be into staying in a vintage building with a vintage setting (high ceilings, old school veranda/elevator etc), this one's for you. Some frills of a contemporary flat are not there, but I think the design of this flat is definitely worth it. It's very authentic and very well thought of. Dimitrios is an excellent host and has been extremely kind - we were greeted with wine/full fridge/his mom's homemade jams, etc. And he is very responsive gave us loads of tips about the city and he even called some restaurants for us. All in all we were very pleased with our stay. "
360940,11923396,2014-04-19,1403819,Dimitris,"Dimitris is a great host and a fantastic guy in general. He was very attentive to making our stay enjoyable and very comfortable. Fresh cookies and a cake were waiting for us at checkin and he showed the place with patience.

The house itself is big with good views and was very clean on our arrival. Great for art lovers.

The Flat prefers takes a conscious stand on the design and adventurous side rather than the super comfortable one. And that's one of its beauties."
360940,13020688,2014-05-17,2692714,Marica,"I cannot begin to explain how pleased we were with the Flat. It is everything that we have ever dreamed of in a bnb and more. Demitrios and Eva are the most gracious host. The flat had the best vibe. Demitrios was so accommodating that he allowed us to leave our luggage while we went to other destinations between stays at the Flat. The only drawback was that the flat was not close to any metro station but everything else about it, most especially the flat mates more than made up for the location. We had our last meal on Athens with Dimitriois and Eva and became fast friends. It also has the best coffee. Will definitely recommend this. "
360940,13435139,2014-05-27,12609409,Asia,"The flat was exactly how it is pictured. We absolutely loved the decor. Dimitrios was so friendly and extremely helpful. When we first arrived he spent a good amount of time explaining and suggesting things to do in Athens and answered our many questions. He also sent us a detailed email with suggested places to eat, things to see, radio stations and lots of other little tips. We were also welcomed with a bottle of wine and brownies!! Which was a plus for us lol

The neighborhood was nice and we often saw families and children playing outside. A couple of cab drivers mentioned that it wasn’t "" the best area"" but honestly we enjoyed the local feeling we experienced and didn’t perceive it to be a unsafe area. We took cabs everywhere we went because it was cheaper for us (being a group of 4) and getting a cab was really easy just up the block.
"
360940,14041574,2014-06-10,6435897,Kasturi,"It's an amazing artistic and lovely apartment. While we managed to stay for only one night at this apartment, on our way out, the visit to Greece was definitely richer by this one night's experience.
The locality is cosy and residential, and just off the main road. The Acropolis area is just a short cab ride away.
The host Dimitrios is very friendly and likes to support his guests by sharing little notes that make Athens seem like home.
Would definitely repeat :)"
360940,14835719,2014-06-27,13559596,Varya,"we had a great time in the FLAT.The apartment absolutely the same as the (website hidden) has a convenient location on the subway,so get to the center takes less than 20 minutes.Dimitrios was very friendly and gave many useful (website hidden) he sent a detailed emails that we can see and do in (website hidden) certainly helped a lot!
thanks for all!
hopefully we will be back soon!
"
360940,15078425,2014-07-01,6201207,Daniel,"We stayed 2 days at The Flat.
It was a great experience. The place is in a safe área and you can go to the center (Monasteraki) in less than 5 minutes by taxi and it will cost around 5 euros.

The Flat has two rooms with big windows and doors. There is no air conditiong in the rooms but the host provided us fans (just in case), but the rooms are vvery fresh - even with the warm weather of Athens.

The host was waiting us on time (actually we ser late because of the boat from Mykonos) and he did everything to make a great experience been there.

If you prefer to stay in a place quiet, calm and away from the center, this is a nice opportunity. "
360940,15290058,2014-07-06,14053450,Rodrigo,Lovely apartment... seems you are in a movie... It was a great experience :)
360940,20126587,2014-09-23,3138284,Stephanie,"""The Flat"" was my 5th experience with AirBnB. We booked Dimitrios's apartment based on the amenities it advertised / we required - WIFI, an equipped kitchen for simple cooking and a nice patio - a good home base from where we could comfortably continue planning our vacation in Greece. When we arrived on a Friday, Dimitrios was out of town but his friend Eva was there to welcome us, she was very nice and friendly. After she showed us the place we tested the wifi and the connection was very poor. She contacted Dimitrios to solve the issue. We later heard back from Dimitrios saying that he called the internet company but they couldn't do anything until Monday (the day we were to leave). His flat doesn't have its own router - the wifi signal comes from the neighbor and is sent via a wifi repeater, which was barely able to connect to the internet - Eva tried to reset it next door but it never worked except an occasional slow 2 minutes before dropping the connection. We got full 5 bars of reception - but NO actual connection to the net. The solution - IF we sat right beside the front door or in the hallway, it could work for a little longer. It was good enough to order a cab from a smartphone app, but the connection was not fast or solid enough to access the web for any length of time needed to plan anything - not even find a hotel! We literally wasted 2 days sitting by the front door trying to plan our activities. The furniture was laid out differently than on his website. Dining room and living room were switched around. Sofa was put on a plywood / wooden pallet 'stage' - Not very user friendly. The kitchen description speaks of a mini oven. There was no mini oven, just a microwave and a panini maker! Glasses in the cupboard full of spots, generally the cleanliness was not what I had previously experienced through AirBnB. No knives to cut bread, fruit or veggies. Used, open bottles of pop, wine, mayo and jam left in the fridge (leftover from previous renters I assume.) The patio was great although watch out for the awning bars, they are very low and hurts the forehead, a ribbon or something to catch your eye would be helpful to avoid hitting your head - the sun is bright and makes it hard to see. BUT, The very first sign of trouble was when using the bathroom for the first time... There was a big 'skid mark' already in the toilet (and black stains / mold behind the toilet). This was seen right after Eva told us the place had just been cleaned by the woman next door before we arrived. My spouse woke up the next morning with multiple bug bites on his body. Be careful of the exposed hot water pipe on the wall when in the shower, its..."
360940,20536066,2014-09-30,19637799,Andreas,Dimitrios organised my booking at short notice and got the flat together in perfect order for my visit. He was happy to give me information about the area and stocked the house with some food and drink which really helped. The flat is very spacious and comfortable and everything worked great. The area is also decent and many hours were spent on the balcony enjoying the view and peace and quiet. A great flat for the price in a really decent location and a host who was happy to help with anything I needed. Would recommend to others.
360940,29470584,2015-04-07,5369202,Daniel,"We had a great time during our long weekend at Dimitrios' place. The Flat is amazing, and is very well located. Dimitrios' was very kind when receiving us, and accommodating to our needs. He even left us a welcoming basket and constantly checked if we needed anything. I would definitely  recommend to stay at Dimitrios'"
360940,32711725,2015-05-20,2231963,Natali,"Dimitris is an excellent host. Very friendly!!!
He waited for us at the apartment and welcomed us with wine and muffins. He made us feel at home.
He took time for us, showed us around and gave us tips where to go for drinks and good food. He even send us a mail with great places, which we visited.
The apartment is fabulous and very clean. In real its bigger than it is on the pictures and with every day you spend there you realize more details, funny stuff and vintage things in there. The balcony is huge. We spend a lot of hours there drinking wine.
The neighbourhood is good and there is a park right in front of the house. It's just a five minute ride with the taxi to syntagma square.
We loved Athens and we really enjoyed this apartment.
Dimitri was also there when we left and called us a taxi to the airport.
Thank you so much. We had a great time and we will come back."
360940,33181119,2015-05-25,15252738,Gwenn,"Dimitrios was absolutely lovely and a really great host. My friend and I had an excellent 2-night stay at the flat and everything went very smoothly. The flat is very cool and true to the pictures and there are lots of welcoming little touches. Location is good (although we found that a lot of taxis had difficulty finding the street). Dimitrios gave us a good list of tips for places to eat and visit, etc., which we appreciated. I would highly recommend a stay at the flat!"
360940,34091920,2015-06-04,12284514,Isaac,"You could not ask for a better host! Dimitris went out of his way to make us feel welcome and provided us with so many helpful suggestions of sights to see, places to eat etc. He knew we were vegan so made sure there was fruit and nuts for us to snack on, on arrival. The apartment was clean and tidy and everything worked fine. We really liked the neighbourhood and had home-cooked meals out on the balcony most evenings, so felt very at home. Location is great- close to the city centre but far enough out if you want a bit of quiet time.
Loved the ethos of the flat as a non-profit arts space. Would definitely stay here again! "
360940,34591542,2015-06-09,11715074,Cs,"Beautiful apartment, Dimitrios was very friendly and helpful with all our neeeds. Seriously recommended. "
360940,35426007,2015-06-18,29286178,Lauren,Amazing stay at the flat!! Everything was exactly as described. Dimitrios has snacks for us on arrival which was perfect after our ferry. The balcony is awesome to sit and chill. Taxis were super easy to get from the main road (even when we left for our flight at 4am).
110085,287066,2011-05-29,323091,Darren,"Terrible experience. Owner is extremely unfriendly and hostile. accused us of being drug abusers when he saw body powder on the bed, repeatedly used vulgarities, called us abnormal, said we messed up his place when it was not at all messy, threatened to call the police, threatened to kick us out ,warned us not to give him a bad review, blamed us for the wet floor in his kitchen when his washing machine malfunctioned, made us pay 20euros to open the door to his house(we accidentally left the keys locked in), made us pay for his phone bills(overcharging us), atrocious attidue and terrible serivce.

Ruined my entire greek (website hidden) NOT USE ROOMS FROM THIS GUY.

it was also terrible location.

he continues to claim that merely accidentally leaving the keybehind(by pure accident and yes, folly) was ""extremely irresponsible"" and therefore deserving of the numerous vulgarities and threats he used against us. we even have pictures of theapparent ""messy state"" the place was in (which of course is not even messy).

tells me he wants to take this up with  my country's consulate nw.

future users, you decide. is leaving a key in the room by accident (the door autolocks) deserving of such atrocious treatment. it really is  your choice.cheers, only wanting to help here"
